"HelpfulYes","ProductID","Rating","ReviewID","ReviewText","ReviewTime","ReviewerName","Sentiment","SentimentScore_Mixed","SentimentScore_Negative","SentimentScore_Neutral","SentimentScore_Positive","Summary","TotalVote","UnixReviewTime"
"0","D007WTAJTR","5","ANIETNRXG4B27","I ordered this card for my Samsung Note 3.  I had to properly format it for my phone which was easy.  I transferred all of my pictures and music from my old card and it works like a charm.  I picked this card as it is the max the phone allows.  This card was a very good price and I got it next day during the Christmas rush even though I used my free 2 days shipping.I would buy another if I had another device to use it in.I would buy again!As usualSanDisk is affordable and works well!","21-02-2014","Yancy Smith -Yancy-","POSITIVE","0.0019431376131251454","0.000364589795935899","6.897487764945254e-05","0.9976232647895813","Great Memory Card","0","1392940800"
"0","E007WTAJTS","5","AXPX8RH5Q6YPS","I purchased this for my go pro hero 3... Its a solid cardbut unless your planning to buy several I would recommended going with the 64 gig. At the higher capture setting you can only get a little over an hour or so of video time.","22-12-2012","Ian A Jones","MIXED","0.981659471988678","0.008379639126360416","0.0014434612821787596","0.00851740874350071","Purchased for my go pro","0","1356134400"
"0","E007WTAJTS","4","AYXSOX5UDOTTY","Good productit arrived extremely fast and performs just as described. It was considerably cheaper than any other store I found. I specially like the speed of this SD Card. However do keep in mind that the speeds tend to be exaggerated. The speeds are way faster than normal SD CARD speeds and you will notice itbut not anywhere close to whats advertised. There a lot of factor that go in to consideration when it comes to the advertised speed. This is not the manufacture or seller faultbut it depends on the system that is being used.","21-07-2013","k24A8","POSITIVE","0.49735116958618164","0.0016719370614737272","0.0006376575329340994","0.5003392696380615","Works just as described","0","1374364800"
"1","C007WTAJTP","5","A2M728B5LXGSQP","Card is fast and reliable in my Galaxy Note 2 cell phone.  Copied my whole music collection to it.  No problems.","27-02-2013","QSM","POSITIVE","1.4572985492122825e-05","3.689911318360828e-05","0.0009912432869896293","0.9989572763442993","Mucho Memory!!!","1","1361923200"
"0","F007WTAJTQ","5","A46D3MTB5LIUY","I have no issues with this Micro SD.  I purchased it for use with a video camera and it does everything I would expect without any problems.  Wouldnt hesitate to purchase again.","19-03-2014","Ocean Blue","POSITIVE","6.134620343800634e-05","7.631476910319179e-05","0.00018734826880972832","0.9996750354766846","Works Great - Purchased for Video Camera Use","0","1395187200"
"0","F007WTAJTQ","5","A3VV4YJ9LMF5TK","Lots of storage for little money. There is nothing not to like...except I have to keep writing words because there is a minimum required to rate products on Amazon (probably the only thing I dont like about Amazon). I dont like thatbut this was a great deal.","06-05-2014","Landons mimi","MIXED","0.8426089882850647","0.0025517218746244907","0.000288737122900784","0.15455052256584167","Cant beat the price","0","1401926400"
"0","E007WTAJTS","5","A3SCHDQPNM5E7R","Works great on my Galaxy S3.  I have not had any issues with it in about a year of ownership.","12-01-2013","Gabriel","POSITIVE","0.00020509384921751916","0.0001272803492611274","0.0009116703877225518","0.998755931854248","Good uSD card.","0","1385856000"
"0","F007WTAJTQ","4","A3S3DWC1A77BHD","reasonable pricegood quality. not much more needs to be said.","07-01-2014","occamsrazor","POSITIVE","7.826026558177546e-05","6.583045615116134e-05","9.67516825767234e-05","0.9997592568397522","reasonable pricegood quality","0","1404172800"
"0","E007WTAJTS","5","A3AJEBW4AK4TWB","Works great and faster than a conventional memory card. videospictures and access run smoother. highly recomnended for those who are in need of great space.","14-03-2014","Ian Pimentel","POSITIVE","1.941825212270487e-05","3.39877515216358e-05","0.0002360543148824945","0.9997105002403259","Worked Great with Samsung Galaxy S3","0","1394755200"
"0","D007WTAJTR","5","A280KHZO2L7GKA","I use this in my Galaxy S3 so that I can carry all my MP3s that are on my iPOD classic (45GB).The only complaint I have is not with this unitbut with smartphones in general.  They are still to sensitive to be used as a true mp3 player replacement.  If you are not too carefulyou may crack the screen on your phone if you try to use it as an all-purpose media player.My ipod classic is five years old and it has yet to have its screen crack on me.  It definitely hold up better at the gym than my phone.  Anywaythis SDXC card is great.","17-12-2012","V. Aub","MIXED","0.6361756324768066","0.03958704322576523","0.004080950282514095","0.320156455039978","Great Mass storage device for your smartphone","0","1355702400"
"0","C007WTAJTP","1","A2SVI2JSSMA3PS","Hello Great cardgreat price. Plenty of speed and worked for...about a year. In factI wish it had stopped working a month earlier.It looks like Sandisk is out to make sure their cards stop working perfectly after the return window is up or somethingbecause now on the end of December (Return window expired about 20 days ago) this thing only intermittently is recognized. It unmounts all the time in my phone and then gets remountedand usually it doesnt even remount.While it was a good priceit was a good price for a name brand card that would have lasted longer than a year instead of Sandisk going &#34;ahaha got you goodnow you have to buy another expensive name-brand card!&#34;NopeIll buy a cheaper alternative and itll probably last longer. I still have some Kingstons going strong.","26-12-2013","Zackariah Zielieke","MIXED","0.8178051114082336","0.151105135679245","0.0003669183643069118","0.03072279877960682","It worked good until return policy was out","1","1388016000"
"0","E007WTAJTS","5","A3P95KM65RH5ND","I needed more memory because my phone kept telling me I was short on memory. This is more than enough memory and I have so many pictures on my phone now! This was a good buy!","21-02-2014","Kate White L White","POSITIVE","9.61641562753357e-05","0.0004474175220821053","0.0001603137206984684","0.9992960691452026","Perfect for my phone for more memory!","0","1392940800"
"0","D007WTAJTR","5","A259A4DBGL23F3","I bought this for my Samsung Note 3 so I could store my entire music library on my phone. All I had to do was pop the coverand put it in the microSD slotand it worked perfectly! My phone now has 96GB of storage. Take that iPhone!","05-10-2014","EAC","POSITIVE","0.0001489069254603237","0.0006586075760424137","0.0008771319407969713","0.9983153343200684","I am still amazed at how much this thing can store!","0","1399680000"
"0","E007WTAJTS","1","AYQ1LKYKODTNC","After a small preasure while trying to remove it from a device it got brokenAlsothe I/O speed is not amazingeven for a Class 10","04-08-2013","Ignacio","NEGATIVE","0.0024801972322165966","0.9959067106246948","0.000685567909386009","0.0009274176554754376","Gets easily broken","0","1365379200"
"0","D007WTAJTR","5","ANKW9L1GU0HTB","I had no problems transferring stuff over to it including 30 GB of songs.  It was much faster than offbrand.  I got this in 12/2012.update: 8/2013:  I got my wife a new samsung galaxy S4.  Her old phone would only do 720p video and didnt have a nice camera.  My wife is really into her photosso I was concerned it wouldnt keep up with the fancier camera.  After loading my now 33 GB of songs I got even more concerned in wouldnt keep up with the fancy new camera.  I bought one of the sandisk 64 GB extreme cards and was amazed at speed difference copying songs.  Due to prior problems with generic cardsIll only buy sandisk in future.Nothing was wrong with the ultra cardit just didnt seem up to par to fully take advantage of the latest/greatest phone technology.  Shes going to carry the old card in purse in case she fills first one.","19-06-2013","Dale Basemann linkinlogin","NEGATIVE","0.39054250717163086","0.4393896758556366","0.007705118507146835","0.16236262023448944","Worked great for my wifes Droid 3","0","1371600000"
"0","D007WTAJTR","5","AVKDNIKIX452Y","I wish I could install one of these in my head.  But I will have to settle for installing it in my brain.  The increased memory for my tablet has been great allowing me to use it for many things.","09-04-2013","FawnM","POSITIVE","0.12797054648399353","0.004665770102292299","0.0021492252126336098","0.865214467048645","More Memory","0","1378252800"
"0","E007WTAJTS","5","A2TX1WQFAVHSSK","So far I have not have any problems with this memorythe transfer speed is good and it works just great on my Samsung Note 8","29-05-2013","J03L","POSITIVE","0.0004425403312779963","0.0001339820009889081","0.0003665951662696898","0.999056875705719","Great Memory","0","1369785600"
"0","C007WTAJTP","5","A1TRU7O0PSSSP7","Overalla great purchase with a reasonable price. I have bought 4 units and all working well in various devices","27-04-2014","Calvin","POSITIVE","4.9939433665713295e-05","6.288066651904956e-05","0.0002744995872490108","0.9996126294136047","Great performance with great price","0","1398556800"
"0","B007WTAJTO","4","A3SBTW3WS4IQSN","No issues.","23-07-2014","","POSITIVE","5.568235428654589e-05","0.00013626465806737542","0.008523995988070965","0.9912841320037842","Four Stars","0","1406073600"
"0","F007WTAJTQ","5","A2UGAIX0KSDJSE","Hasnt even blinked in my MP3 playerand gave me loads of room for expanding my library.  I trust the SanDisk name with all my electronic gear.","12-08-2013","PA Pete","POSITIVE","0.0020751215051859617","0.06888990849256516","0.013482419773936272","0.9155524969100952","As usualSanDisk delivers a quality product","0","1386460800"
"0","D007WTAJTR","5","A3TGY6ZWPMOPHE","So far i havent had any issues. Its working and is compatible with my phone. Quick shipping. Im satisfied with my purchase","16-09-2013","yali g","POSITIVE","1.7143436707556248e-05","2.381822014285717e-05","0.0002289579133503139","0.9997300505638123","16gb micro","0","1379289600"
"0","B007WTAJTO","5","A3PSG14OAK2A5F","My Android tablet is a toy; there is nothing crucial on it. I plan on downloading maps for traveland need more storage.I rooted my tabletchanged two lines in a control fileand now it sees the external card as the internal card (and vice versa). When I save apps and/or data to the SD cardeverything goes to the 32GB SanDisk Ultra MicroSDHC card instead of the puny internal store! Woo-hoo!DISCLAIMER: Rooting a device usually voids its warranty. I am not condoning such actionnor am I responsible for the results of such action. The responsibility is yours.The tiny card fit into the tiny slot on my 9&#34;-screened tabletand is invisible once installed. But we both know its there! I couldnt be happierand until that changesthis is my endorsement of the SDHC card.","18-06-2014","Badotz Badotz","MIXED","0.6749886274337769","0.20857635140419006","0.032177362591028214","0.08425770699977875","My Android tablet is all growed up!","0","1403049600"
"0","C007WTAJTP","5","A1TL1P030KYGAD","From what Ive readsome Galaxy users have had problems with MicroSD cardsbut this one works great so far; lots of apps are willing to store their data on itand Samsungs built-in camera is able to put its photos there instead of in the system memoryso it helps free up a lot of space for apps and things that have to be in the system memory. Ive put all my MP3s on the card as well and they play back perfectly using both the Samsung music app and Google Music.","15-08-2013","Dagmar Miura","POSITIVE","0.08316271007061005","0.0010378251317888498","0.0014212545938789845","0.9143782258033752","works perfectly with Galaxy S4","0","1376524800"
"0","B007WTAJTO","5","A2IDCSC6NVONIZ","Its mini storage.  It doesnt do anything else and its not supposed to.  I purchased it to add additional storage to my Microsoft Surface Pro tablet which only come in 64 and 128 GB.  It does what its supposed to and SanDisk has a long standing reputation that speaks for itself.","29-04-2013","2Cents!","MIXED","0.48397690057754517","0.04792573302984238","0.01949281245470047","0.448604553937912","Not a lot to really be said","0","1367193600"
"0","F007WTAJTQ","5","A3TFQNPJ8F6ET1","Very fastno problem in work. Im very content with his performanceprice and all of my file has enough space for the next year as well.","31-05-2013","Nandor","POSITIVE","3.053661930607632e-05","3.0806193535681814e-05","0.0004747289640363306","0.9994638562202454","Perfect","0","1369958400"
"0","F007WTAJTQ","5","A2TYY8YPS1X128","Works on my Samsung Galaxy Note II. SanDisk is a product you can trust. Cheapest price I could find. Thanks!","28-12-2012","Sal","POSITIVE","5.164859976503067e-05","0.0002897236554417759","0.0016911852871999145","0.9979674220085144","MicroSD 64GB","0","1356652800"
"0","F007WTAJTQ","5","A18MKVZDPEFYDB","I love the card unfortunately my note 2 does not allow app install on the SD therefore i have not been able to fully test this card","01-03-2013","Salim C. El-hayek","MIXED","0.9806473255157471","0.00979098305106163","0.0009892815724015236","0.00857253186404705","microSD","0","1357171200"
"0","F007WTAJTQ","5","A2ZW3HX7670JFE","The card was perfect.Bought it for my Virgin Moble Smart phone as it only had a 2 gig card in it.Their Geek squad told me I needed a larger card as my memory to download applications was almost out!! (Only had 2 dowloads on it!!!).After purchasing and  inserting the expensive cardI got the same screen --- can not download applicationas memory is almost filled.Turned out the memory card has no bearing on applications being downloaded - they are  stored on internal built in memory.Seems the phone I was suggested to purchase only has 2 gigs of internal memory.Was not told to me when I got it","03-04-2014","Parkhiker","MIXED","0.6010559797286987","0.22856801748275757","0.0007582007092423737","0.16961784660816193","Great card but waste of money","1","1393891200"
"0","F007WTAJTQ","5","A2GNBHAJRCS0I5","This card is so small and yet holds this much storage. No problems with speed or reliability. Can definitely recommend.","06-07-2013","Papadirk","POSITIVE","0.00017617047706153244","0.00019275756494607776","0.00010122062667505816","0.9995298385620117","reliable. Can recommend","0","1370563200"
"0","C007WTAJTP","5","A2N9ADDVQCMS42","PROsIt copies large files to the card at ~10-12 MB/s and it doesnt choke when slammed with a few hundred little files like pictures and mp3s. It writes 8mp images with a quickness and 1080p 20mbit recording is smooth in my LG Optimus G E970. I waited for these to get to ~this price before orderingand as usual Amazon Prime is awesome.CONsNot as fast as the gold 16GB SanDisk microSD cards but for 64GB in this form factorits faster than I was anticipating.","22-12-2012","Wade Wade","POSITIVE","0.09560855478048325","0.002862689783796668","0.003930388018488884","0.897598385810852","Slightly over advertised speed in exFATbarely rated speed in FAT32 :-)","0","1356134400"
"0","D007WTAJTR","5","A1QQA7Y92L4F9R","People often ask me about bargain-basement pricing on no-name brands of mediaand you know I just have to cite my own experiences with cheap mediaand its just thatcheap mediaprone to failure or worse if its a complex format as this one isthe SDXC format. They have crammed a TON of memory modules in that little bujggeryou know? I say go with experiencego with a leader in the fieldso theres pretty much SanDisk at the top of the heapand the rest trail farfar behind in volume and precision assembly techniques...so I vote for SanDisk every timeand unless my experience is changed  by some anomaly Ill keep on recommending SanDisk above all others.Its rated at 40MB/sec write speedwhich is enough to keep up with even the fastest real camera or phone camera out there in the wildand it certainly keeps up with my Samsung Note 3s 13-mega-pixel rocket cameraone that shoots up to 8fps in burst mode taking certain shotsso if it works for that camera perfectchances are it will work for your setup great also!Buying the SanDisk memory module costs what$5-$7 more than the others maxright? I say buy this one hereits a winner in all respects.Wavey Davey 1-12-2014","01-12-2014","Wavey Davey","MIXED","0.7057123780250549","0.13481874763965607","0.05372203141450882","0.10574687272310257","SanDisk makes a MEAN SDXC-series of Micro-USB chips!","0","1389484800"
"0","C007WTAJTP","5","A8DZAXOHH73L1","either it works or it doesnt -- it worksit was a fair price and I am happy with it","18-05-2014","RadioMaven","POSITIVE","0.04151942580938339","0.0009240755462087691","0.0024745233822613955","0.9550820589065552","either it works or it doesnt -- it worksit was a fair price and I am happy with it","0","1400371200"
"0","C007WTAJTP","2","A1THCY79HLXT2O","Before doing researchi assumed this card would support my brand new Hero 3 camera... considering it was sold off the Gopro siteit was a no brainer... or so i thought.Anyhowthe card seems to preform well under most circumstances WITHOUT using the Protunes settings. (The problems with the Hero 3 where due to the slow write speed of this card under Protunes settingswithout this setting the Hero works fine)Howeverafter a few timelapse issues (2 - 5 sec timelapsewhich is well in this cards speeds).I noticed the card is corrupt. I tested this in other cameras and found that this problem still persists. I trust Sandisk as my top choice for all my professional workhowever this card has failed!I would not recommend this EXPENSIVE cardid jump for a Samsungor even the Transcend cards. They even come with a better warranty then this card.Nothing but problems and lost memories that i cant replace....","19-08-2013","DaiLon","MIXED","0.7752938270568848","0.06203518435359001","0.0024007188621908426","0.16027018427848816","Bought this for my Gopro Hero 3","0","1376870400"
"0","C007WTAJTP","5","A9GAT0U952GOY","great product......prompt service.......well done!","07-03-2014","Radar999","POSITIVE","0.0011215500999242067","6.562433554790914e-05","8.317540778080001e-05","0.9987296462059021","Five Stars","0","1404345600"
"0","E007WTAJTS","5","A1LKN9HYJ7561R","this is probably the Nth memory card Ive bought from sandiskand so far Im still very happy. r/w speeds are decent and none have given me any troubles.","01-10-2013","Gabby Ybanez","POSITIVE","0.00775510910898447","0.0008616652339696884","0.0014046975411474705","0.989978551864624","always been happy with sandisk","0","1357776000"
"0","B007WTAJTO","5","A13OV96DEUAR1F","Ive purchased 3 of the 32gb cards now. One each for my Galaxy S3 and my wifes. Also one for her Galaxy Tab 2 7.0.The cards are super fast and there have been no problems. The one in my S3 has been in it since they came out last year no issues at all.I purchased a 16gb for our Roku2.You cant beat the quality and price.","27-04-2013","Talon8Ya","POSITIVE","0.00024369434686377645","0.00015856434765737504","0.0004419498145580292","0.9991558790206909","Excellent speed and quality.","0","1367020800"
"0","E007WTAJTS","5","A2OCHLZTLG5KDS","Having a 32gb mirosd is great! I use it in my phone and hardly have to upload my pics and what not. My phone works faster with all the extra space and I never have to worry about needing to delete any songs pics or apps.","19-03-2014",":)","POSITIVE","7.163538975873962e-05","9.299138037022203e-05","0.0010676970705389977","0.9987677335739136","So useful","0","1395187200"
"0","B007WTAJTO","5","A2BZKMVWBQ2VLE","SANDISK makes great productsI always try to buy their name. This is for the Sony digital recorder I also bought.","05-03-2014","Valentina DiveGirl55","POSITIVE","0.0006766307633370161","0.0009714033803902566","0.006179626565426588","0.992172360420227","SANDISK makes great productsI always try to buy their name","0","1399075200"
"0","C007WTAJTP","5","A2FRK17ETLK7UY","Super fast access to my Samsung Galaxy Note II. SanDisk Ultra Micro HC is blazing fast compared to the other microSD cards I have bought including PNYSony and more!","23-11-2013","Zachary Flategraff","POSITIVE","5.149989647179609e-06","5.641410098178312e-05","0.0007565776468254626","0.9991818070411682","Awesome for Price and Very fast data accessibility!","0","1385164800"
"0","F007WTAJTQ","5","A1OGCPMSIVK7G4","The name should speak for itself! It comes with a regular SD card adapter. If one day you feel that you have no need for a microSD card then just simply put it back into the adapter and use it as a regular SD card for your camera or other electronics that takes a form of a regular SD card. It reads and write very fastwhich it should since its a class 10 card! I bought this for my Samsung Galaxy S4 and its a nice addition to storing those big 1080p files & MP3 music loads. Hands down the best brand in the industry for SD cards! I highly recommend it!","20-11-2013","ocxmichael","POSITIVE","0.011821279302239418","0.0015194898005574942","0.005564368795603514","0.9810948371887207","Its SanDiskwhat more can I say?","0","1384905600"
"0","B007WTAJTO","5","A80SHWURCS1KD","Works great in a Samsung Galaxy S3.  Formatted straight awayfull size there.  I cant really tell the speed difference between this one and a slower card it replaced.  I guess the IO in the phone cant take advantage.","29-12-2013","Aaron","POSITIVE","0.11061082035303116","0.006649956572800875","0.0030400357209146023","0.8796992301940918","Good with Galaxy S3","0","1388275200"
"0","B007WTAJTO","5","A2S7XG3ZC4VGOQ","in my galaxy s4super fast cardand am totally happynot happy having to still type to fill the required words though","10-11-2013","53rdcard","MIXED","0.94066321849823","0.0017409780994057655","0.0003442026791162789","0.05725155025720596","works great","0","1381449600"
"0","D007WTAJTR","5","A35ZLKM1A86J68","Works exactly as it should.  No issues in the Samsung Galaxy s5.  Have not noticed any speed issues as well and I use it plenty for movies.","25-05-2014","FastEarle","POSITIVE","0.00015139573952183127","8.57904669828713e-05","0.00037589599378407","0.9993869066238403","Would recommend! No issues at all!","0","1400976000"
"0","B007WTAJTO","5","A1V6CQACZ9IOLC","The read and write speeds are better than the Samsung SD card that I had previously. I would not hesitate to buy another one of these great Micro SD cards from SanDisk. I also own their Clip plus MP3 player and it works very well. I think Im becoming a fan of the SanDisk products.","05-02-2014","Aaron Graves","POSITIVE","4.037492544739507e-05","8.017224172363058e-05","0.00014324176299851388","0.9997361302375793","Very good little Micro SD card","0","1398988800"
"0","E007WTAJTS","5","A1TRZPSFDBLLVL","I wished it came with some sort of USB converter so I can transfer files faster to my PC. I am using a Samsung Galaxy Note 2 and File transfer speed is mediocre.","08-11-2013","IamSerda","NEGATIVE","0.0014124144800007343","0.995165228843689","0.002689291490241885","0.0007329924264922738","I use this everydayit is Excellent","0","1376179200"
"0","E007WTAJTS","5","A66DVSZBDHH8T","I bought this one for my tablet... well it is very fast. durable and long lasting... I recommend this item...So get one now.","27-05-2014","I am Gerard","POSITIVE","1.762079591571819e-05","5.603013050858863e-05","0.000152017644722946","0.9997743964195251","All strong Memory card","0","1401148800"
"0","C007WTAJTP","5","A301Z8IOK3T238","I use it to hold files from my computer and transfer files from other computers it works good for this task and is quick. I would recommend this plus the price isnt bad.","20-07-2013","Zak Diva","POSITIVE","0.00010704658052418381","5.48089446965605e-05","9.013521048473194e-05","0.9997480511665344","Good SD Card","0","1374278400"
"0","C007WTAJTP","5","A1050XS5BK823I","Used this in my S4 and in my new S5. Transfer speed is good and it is still performing well after almost a year. I havent been disappointed with a SanDisk product yet.","24-06-2014","Cal","POSITIVE","0.0007330053485929966","0.00018506059132050723","0.0004187288577668369","0.9986633062362671","Works great","0","1403568000"
"0","F007WTAJTQ","5","A352C9XXLTSJR4","Much faster than my other microSD cardsmost if which are class 4.  In a galaxy S3 nowfast enough not to slow it down when loading files/music/photos.  Did not Benchmark...","21-10-2012","Name","POSITIVE","0.0026095034554600716","0.0015196194872260094","0.0014878778019919991","0.9943830966949463","Neat","0","1350777600"
"0","D007WTAJTR","5","A3NKYCPMP07994","I used this on my dashcam that records 720p continuous for 12 hours without fail. Also used this on my Zoom H1.","19-05-2014","Faisal","POSITIVE","0.0013140970841050148","0.0006835739477537572","0.2832146883010864","0.7147876620292664","Works and still working","0","1400457600"
"0","D007WTAJTR","5","A1GRKJ0VT3HUNB","This sd card is perfect for my phone. It is the right size and especially the right price. After looking all over Amazon price for this card was almost $10 lower than everyone elses.","16-04-2014","Yankeefan","POSITIVE","5.484016583068296e-05","5.994893945171498e-05","0.0002447301521897316","0.9996404647827148","Love It","0","1397606400"
"0","B007WTAJTO","5","A3T5N2QVI8T92D","I bough this to replace an old 1gb card I had in my phone. I am using this in a Nokia Lumia 822 and it works perfectly.","09-01-2013","tahoebigah","POSITIVE","0.04029593989253044","0.01743706502020359","0.02588346228003502","0.9163834452629089","Great product for a great price","0","1377993600"
