ReviewID,ProductID,reviewerName,helpful,ReviewText,Rating,summary,unixReviewTime,reviewTime,day_diff,helpful_yes,total_vote
A3KA9JAZERWWGO,F007WTAJTQ,Mack-SS-Seattle,"[0, 0]","Added this to my Dell Venue 11 Pro for extra storage space.  I popped the card holder out of my tablet, inserted the memory card and the tablet recognized it right away.  Read/write time is as fast as the SSD drive in my tablet.  No complaints here!!",5,Works great,1392681600,18-02-2014,293,0,0
A2I4UIXT2PGSAS,F007WTAJTQ,macman,"[2, 2]","If there is anyone out there curious if this works on Garmin's GPSMAP line of handhelds, then yes! All 32GBs are recognized, and I am maxing this baby out with every map I can get my hands on! No issues at all.Some forums may have you believe there is a 4GB limitation, but there simply isn't (FAT32 - which is the format of the card, has a 4GB limit on FILE SIZE, but that's fine as all individual Garmin maps are under 4GB)",5,Works great in my Garmin!,1396828800,04-07-2014,157,2,2
AI82G1NQHKXGW,F007WTAJTQ,"mac ""TehAsian""","[0, 0]","This chip replaces my previously fried out offbrand microSD.  So far it has performed flawlessly.  If it fails, I will update the review.  I have a Droid RAZR M smartphone.",5,Works nice,1390953600,29-01-2014,313,0,0
A3FN7QLQ6ZI1E,F007WTAJTQ,madapaka26,"[0, 0]",Worth the $30 I spent here then buying it at the store for $65.  Use it for the Galaxy note 10.1 and the Galaxy Note 2!,5,Perfect,1360368000,02-09-2013,462,0,0
A1HJCD42IQQTZA,D007WTAJTR,"Mad Don ""maddon""","[0, 0]",Whats not to like? It is what it is. I always buy this brand of cards and drives. They have never failed me.,4,Trusted name in storage,1383609600,11-05-2013,576,0,0
AE16WAPPF7GUA,F007WTAJTQ,N2,"[0, 0]","Works great in my Samsung Galaxy S4.I also use a SanDisk card in my DroidX, after some bad experiences with another manufacturer's 32GB micro-SD card that occasionally flaked out.Beware imitation cards that may look almost identical.",5,SanDisk is the standard!,1397433600,14-04-2014,238,0,0
AFE3KCCYJX76K,F007WTAJTQ,N7,"[0, 0]","I use this because my office use all window OS and I'm the only one with a MAC OS, so file transfers between computers are easy with this little thing",5,GREAT,1394150400,03-07-2014,158,0,0
A24YWDYFTI2NOC,F007WTAJTQ,N8,"[0, 0]",Bought this to go with my Samsung Galaxy S III. It is class 10 which means it is fast. Works well.,5,Nice price,1359072000,25-01-2013,682,0,0
A352C9XXLTSJR4,F007WTAJTQ,Name,"[0, 0]","Much faster than my other microSD cards, most if which are class 4.  In a galaxy S3 now, fast enough not to slow it down when loading files/music/photos.  Did not Benchmark...",5,Neat,1350777600,21-10-2012,778,0,0
A3TFQNPJ8F6ET1,F007WTAJTQ,Nandor,"[0, 0]","Very fast, no problem in work. I'm very content with his performance, price and all of my file has enough space for the next year as well.",5,Perfect,1369958400,31-05-2013,556,0,0
A2BGLR8HGU1E8F,F007WTAJTQ,naptime84,"[0, 0]",Transfer speeds from just moving files to my phone as well as rooting and adding various roms was much faster than I'm used to. I haven't done any official benchmarking though.,5,Seems fast,1395619200,24-03-2014,259,0,0
A2CQYRZX4D88VF,F007WTAJTQ,Natasha S.,"[0, 0]",No issues at all. I ended up utttingthis in my Samsung Galaxy S3 instead of my Tab2 like I had originally planned. I will be ordering another one soon.,5,good price and fast shipping,1367193600,29-04-2013,588,0,0
AMLWJ1D1J3MS4,F007WTAJTQ,Nate C.,"[0, 0]","I bought this memory card for my smartphone (Nokia Lumia 521) when my older 8GB micro SD card died on me (amazon basics brand).I threw on some MP3s on there to listen on my phone on my trip up the California coast since I knew some areas wouldn't have any radio or cell phone reception, and had no problems with it.I haven't done any speed tests on it as I'm not using it for anything that needs extreme speeds. Its has more than enough speed for capturing video and and pictures.Its a great deal for the amount of storage and its price.",5,Great Memory Card,1383091200,30-10-2013,404,0,0
A27MR2K55DJUFK,F007WTAJTQ,Nate,"[0, 0]","plenty of memory for my gopro, durable, and small enough to lose haha... make sure your phone/device can handle it",5,Yes,1393804800,03-03-2014,280,0,0
A3KPIYXAGWMQXY,F007WTAJTQ,Nate,"[0, 0]",Used this in my old phone and it works great. Quick with transfer rates and loved it for the short amount of time I used it. Will probably use it for something else like a camera or something.,5,SanDisk Ultra 16 GB MicroSDHC Class 10 UHS-1 Memory Card with Adapter (SDSDQU-016G-AFFP-A) by SanDisk,1390435200,23-01-2014,319,0,0
ADHTY6LJFA0RX,F007WTAJTQ,oafsandwich,"[0, 0]",It works great and transfers quickly. I use it on my Dell Venue Tablet and my Polaroid XS100 action camera.,5,Great for me,1394755200,14-03-2014,269,0,0
A3Q6B94A2DMWRW,F007WTAJTQ,OB,"[0, 0]","Quick shipment, product as described.  Comes with adapter which will come in handy.  SanDisk is a great product, it usually delivers quality item.",5,QUICK SHIPMENT,1386374400,12-07-2013,514,0,0
A3S3DWC1A77BHD,F007WTAJTQ,occamsrazor,"[0, 0]","reasonable price, good quality. not much more needs to be said.",4,"reasonable price, good quality",1404172800,07-01-2014,335,0,0
A1ST94P7R4IM4L,F007WTAJTQ,"Occasional Reviewer from Michigan ""Mark""","[0, 0]","It appears that the 32GB SanDisk Ultra Micro SD Card I purchased from Amazon was defective.  I installed it in my Samsung Tablet, but could not successfully transfer files using either a USB cable or WiFi.  The file transfer would appear to start, but then would slow down and hang completely.  It did this on every one of multiple attempts, with different file types, and numbers of files ranging from many to just a single file.  I tried loading files onto the card directly from my PC, but then the Tablet would not see them.  I tried reformatting the card both in my PC and in the Tablet, but still got the same result.  After a few tries, the Tablet would appear to format the card but then tell me that the card was blank/unformatted.  I did an A/B/A with an old 8GB Sandisk Micro SD Card that I had laying around.  It worked perfectly -- formating, transferring files, reading and writing files -- everthing worked.  I put the 32GB SanDisk Ultra Card back in the Tablet, but had the same problems again.  I concluded that the SanDisk Ultra card was defective and returned it.  I'm still using the old 8GB card without a hiccup.The good thing was that Amazon's return policy was quick and painless.",1,Did not work in Samsung Samsung Galaxy Tab 2,1363996800,23-03-2013,625,0,0
A46D3MTB5LIUY,F007WTAJTQ,Ocean Blue,"[0, 0]",I have no issues with this Micro SD.  I purchased it for use with a video camera and it does everything I would expect without any problems.  Wouldn't hesitate to purchase again.,5,Works Great - Purchased for Video Camera Use,1395187200,19-03-2014,264,0,0
A24IZ2L7W5L284,F007WTAJTQ,Octavio Barreto,"[0, 0]","I bought the memory to my lumia 620 and it works. It's really faster than my previous microsd (Class 4). No complaints, i'm very happy with my purchase.",5,A fast memory,1400716800,22-05-2014,200,0,0
A1OGCPMSIVK7G4,F007WTAJTQ,ocxmichael,"[0, 0]","The name should speak for itself! It comes with a regular SD card adapter. If one day you feel that you have no need for a microSD card then just simply put it back into the adapter and use it as a regular SD card for your camera or other electronics that takes a form of a regular SD card. It reads and write very fast, which it should since it's a class 10 card! I bought this for my Samsung Galaxy S4 and it's a nice addition to storing those big 1080p files & MP3 music loads. Hands down the best brand in the industry for SD cards! I highly recommend it!",5,"It's SanDisk, what more can I say?",1384905600,20-11-2013,383,0,0
A21EURX5TNA5FA,F007WTAJTQ,odaddio,"[0, 0]",Installation on my Surface was simple and added a lot more storage to my tablet. I liked the SD adapter so that I can use it like a mini USB drive from my larger PC.,4,Great choice for my Microsoft Surface RT,1366156800,17-04-2013,600,0,0
A1LJMQNR9C9DEW,F007WTAJTQ,odey,"[0, 0]",excelent,5,Five Stars,1404691200,07-07-2014,154,0,0
A5TFF8PLKRCOJ,F007WTAJTQ,odin,"[1, 2]","Failed after one month and the problem is epidemic on the sandisk forums , they slowly get corrupted then fail and report only 30-32mb size.The Lifetime warranty is nice, but these products are clearly defective , I'm in the process of RMA now, will update post on status updates.DO NOT TRUST YOUR DATA WITH THIS PRODUCT, KEEP A BACKUP OF EVERYTHING YOU PUT ON IT, I'M 100% serious, just look at the sandisk 'users' forum for 64gb cards.Here is my breakdown while it lastedSanDisk Ultra 64 GB microSDXC Class 10 UHS-1Write speed  was 8-10 Mb/s (usually 8, tested windows usb 3.0 reader, and android)Read speed 27 mb/sFAILED @ 1 1/2 monthsUpdate 2-13-14Received back replacement item in brand new condition readspeed is 40+mb/s write speed is still around 10-12mb/s - RMA turn around time was about 3 weeks, I will up rating if this one lasts longer then one month.Update 5-1-14RMA replacement is still going strong, upped the star rating by one point.",3,Failed at one month - RMA Replacement is good,1390608000,25-01-2014,317,1,2
A1ZUPNL1XGZPHS,F007WTAJTQ,Pablo,"[0, 0]","it has been awesome, and just enough in size. I have been putting movies in the range of 900mb to 3.5 gb. No issues. Also plays lossless music with no issues as well.",5,"Have been using steady with my Galaxy S3, Verizon. No problems.",1356566400,27-12-2012,711,0,0
A195PVKRNF9AUW,F007WTAJTQ,Pablo Ortega,"[1, 1]","Great memory card, I love the fact that this came in frustration free packaging. And even better, it also came with an SD adapter for free! Thanks a bunch amazon and SanDisk.",5,AWESOME MICROSD Card I LOVE IT,1405036800,07-11-2014,31,1,1
A2NYSDO4SQMGE8,F007WTAJTQ,PantherSpawn,"[0, 0]",Works well in our tablets and phones,5,Five Stars,1404950400,07-10-2014,62,0,0
A3EPL2JV2T11OX,F007WTAJTQ,paolo,"[0, 1]","La uso sul mio samsung galaxy tab 2 7 e va benissimo, raramente non la riconosce, ma basta estrarla rimetterla e tutto va a posto, se fosse spesso sarebbe un problema, ma ripeto succede raramente perci&ograve; consigliata!!!",5,gooooooooood!,1360108800,02-06-2013,554,0,1
A2GNBHAJRCS0I5,F007WTAJTQ,Papadirk,"[0, 0]",This card is so small and yet holds this much storage. No problems with speed or reliability. Can definitely recommend.,5,reliable. Can recommend,1370563200,06-07-2013,520,0,0
A2T5P0O707ESH6,F007WTAJTQ,PapaG,"[0, 0]","Bypass the &#34;cheaper&#34; clones and get SanDisk. Your  data is wprth much more than the little that you &#34;save&#34; using the cheap imitations. Trust me, I just found that out for myself.",5,"Bypass the ""cheaper"" clones and get SanDisk. Your data ...",1404518400,07-05-2014,215,0,0
A3TG01YS74D3OM,F007WTAJTQ,"papatech ""c.p.""","[0, 0]","i just had an incident with my Galaxy S3 phone however where the chip became corrupt.. Is it the chip? Is it the phone?  I put one of these in my Samsung phone and another in my Samsung Tablet.  All is well except for that one time where the chip and phone got funny with each other and I had to erase all my music... The phone was able to format / erase / prepare the chip so it was immediately usable but I did lose my music.  Very weird.  Well, all I have to do is sync my music to my phone.. No big deal..",4,it's a fine little chip.. maybe I got a bad one though???,1360195200,02-07-2013,524,0,0
A2UGAIX0KSDJSE,F007WTAJTQ,PA Pete,"[0, 0]","Hasn't even blinked in my MP3 player, and gave me loads of room for expanding my library.  I trust the SanDisk name with all my electronic gear.",5,"As usual, SanDisk delivers a quality product",1386460800,12-08-2013,483,0,0
A2B250AEJN2EBE,F007WTAJTQ,Parker Alton,"[0, 0]","One of the benefits of having an Android phone is being able to have external storage. I popped this in my phone, moved my apps over, and added some FLAC, movies, and more.I added a selection of movies, and then never watched them. Then I was on a flight across the Atlantic and everyone fell asleep around me, and I remembered that I had added all these HD movies! That alone justified the purchase.Do yourself a favor and add some extra storage to your phone/whatever.",5,For my Galaxy S4,1402444800,06-11-2014,32,0,0
A2ZW3HX7670JFE,F007WTAJTQ,Parkhiker,"[0, 1]","The card was perfect.Bought it for my Virgin Moble Smart phone as it only had a 2 gig card in it.Their Geek squad told me I needed a larger card as my memory to download applications was almost out!! (Only had 2 dowloads on it!!!).After purchasing and  inserting the expensive card, I got the same screen --- can not download applicationas memory is almost filled.Turned out the memory card has no bearing on applications being downloaded - they are  stored on internal built in memory.Seems the phone I was suggested to purchase only has 2 gigs of internal memory.Was not told to me when I got it",5,Great card but waste of money,1393891200,03-04-2014,249,0,1
A32NUTURCII05D,F007WTAJTQ,QR,"[0, 0]","Transfer speeds are good, worth the price tag, use it in my samsung galaxy s3, sometimes it craps out and has to be reformatted or rebooted in phone. Otherwise no problems",4,good,1357084800,01-02-2013,675,0,0
A2M728B5LXGSQP,C007WTAJTP,QSM,"[1, 1]",Card is fast and reliable in my Galaxy Note 2 cell phone.  Copied my whole music collection to it.  No problems.,5,Mucho Memory!!!,1361923200,27-02-2013,649,1,1
AARXTOFZEI7O,C007WTAJTP,queball4u,"[0, 0]","it works, so far, waiting for the heat and cold to see how well it will hold up.",4,testing.,1405123200,07-12-2014,1,0,0
A3LIFZB4RC49DE,C007WTAJTP,Quinton W. Shelby,"[0, 0]",I picked up this storage device to use in my phone. I only had a 1 gig mini sd in there for music ad it was getting pretty full. Now 30 plus gigs of free space later i can download to my hearts content.,5,Great price,1379548800,19-09-2013,445,0,0
A2OJGEX2L2TAJ1,C007WTAJTP,quique,"[0, 0]",you cant beat the price and it works great . I have no problems with the card I use it for my gopro it works great,5,great card,1384473600,15-11-2013,388,0,0
A33QOSYADK6BWK,C007WTAJTP,QZ,"[0, 0]","Great product and price from SanDisc.  I will be using it for my cell phone, replacing the 8GB.  For my video now I have 2+ hours with the 32GB (compared to 20 minutes w/8GB) in &#34;super fine&#34; mode.  All the rest of my SanDisc memory card from years ago are still working 100%!  Thanks SanDisc!!!",5,sandisc ultra micro sd 32GB,1398038400,21-04-2014,231,0,0
A3H0SMLV116RAW,C007WTAJTP,R1Jay,"[0, 1]","I bought this on black friday last year and took a chance on it. What chance u say? I read some reviews that this card just actually STOPPED working for no reason and not due to abuse or misuse. I had this card in my Acer Iconia A500 and it just STOPPED WORKING! Even my computer doesnt recognize it. WTF Sandisk?? This is an expensive part for this to occur. DO NOT BUY OR IF U DO, BE CAREFUL WHAT U STORE ON IT! I only had music and movies on mine so NBD. But what if u had this in your phone with valuable pictures?",1,WHY????,1379548800,19-09-2013,445,0,1
A1W35U95LIJ5LY,C007WTAJTP,"R32_GTR_N1 ""-Raines""","[0, 0]",This card is both small and large at the same time. It's micro size but high capacity are perfect and works well with my GoPrc Hero 3. Recording in 1080p is not an issue either. THe class 10 rating allows the GoPro to do its thing and the card is able to keep up with the high MB transfer rate.,5,PERFECT!,1362873600,03-10-2013,431,0,0
AVL03EBQWSS0L,C007WTAJTP,raaaaaa,"[0, 0]","fast, used it on my dji phantom gopro hd black, not one hickup.i would buy again only cheaper. you get whacha pay for",5,i would buy again only cheaper,1397001600,04-09-2014,95,0,0
A186WJ3EFN42GH,C007WTAJTP,Rabbis,"[0, 0]",Good no problems works well.,5,Micro SD Card,1404864000,07-09-2014,92,0,0
A7JOHG63H2O5O,C007WTAJTP,racer1,"[0, 0]",Love it--so far--as I Just purchased this as Iam not into buying SDcards but now I have a Nextbook tablet and this works great for adding video's and music able to be put on this SD card.,5,Working great so far,1377561600,27-08-2013,468,0,0
A3LTWJZ779E29,C007WTAJTP,Rachel Beckwith,"[0, 0]",My fiance has had this in his tablet for almost a year now without a single issue. I feel that it's one of the best quality memory cards we've ever had. Make SURE you get the retail packaging and not the &#34;frustration-free.&#34; The retail packaging only requires one quick clip of the scissors and it's worth it to get one that is sealed in a package and not at risk to be damaged.,4,High Quality,1377302400,24-08-2013,471,0,0
A2ZMOCCPJWCIV5,C007WTAJTP,"R. Adams ""RSA""","[0, 0]","This is being used in a Mobius Action Camera 1080P HD Mini Sports Cam/dash cam daily so the opportunity for failure or problems would be readily apparent.  It has really delivered as promised.  Speed and reliability are great.  The adapter works perfectly as well.  I have several other SanDisk products including SD cards, thumb drives and an SSD and all have been terrific.So far I can highly recommend the SanDisk Ultra 32 GB MicroSDHC C10/UHS1 Memory Card. I will post again if any issues arise.",5,Flawless So Far,1388361600,30-12-2013,343,0,0
A9GAT0U952GOY,C007WTAJTP,Radar999,"[0, 0]",great product......prompt service.......well done!,5,Five Stars,1404345600,07-03-2014,276,0,0
A2EFKDYHXUM65C,C007WTAJTP,Radek,"[0, 0]","What else can I say? That it is light and small? Not the fastest card on the market, but does the job. Copying files onto it is slow, but it is fast enough to play music or movies from it on your cellphone or other devices.",5,It works,1362960000,03-11-2013,400,0,0
A3RUY3TH5FNNDK,C007WTAJTP,"Radical Technoid ""We know we're right, we hav...","[0, 0]",How cool it is to be able to put ALL of my music on my phone! The little card works just fine and the price is reasonalble,5,excellent as expected,1346889600,09-06-2012,912,0,0
A8DZAXOHH73L1,C007WTAJTP,RadioMaven,"[0, 0]","either it works or it doesn't -- it works, it was a fair price and I am happy with it",5,"either it works or it doesn't -- it works, it was a fair price and I am happy with it",1400371200,18-05-2014,204,0,0
AZ7N0TLPDP156,C007WTAJTP,"Radiskull ""Radiskull""","[0, 0]",Well works just like any other SD card I don;t see ultra fast speeds or any thing. I shoved this guy into a Galaxy S4 and it works fine!,4,Works fine,1389916800,17-01-2014,325,0,0
A3VOHA1ZOPWK0Z,C007WTAJTP,Saber uddin,"[0, 0]","I use it for my galaxy s4 and this card crashed on me few times, i lost all my photos and music. Thankfully they were all backed up but the worst part is, the card completely stopped working at one point. I had to contact sandisk for a replacement and it was a hassle.",3,The card crashed a few times,1400630400,21-05-2014,201,0,0
AK821DBWBPF5Y,C007WTAJTP,Sadiq Shah Mohamad,"[0, 0]",Works as advertised. This is better for using with the newer products. I have noticed a increase in speed with my Note 2 and Note 8 when compared with previous version of SanDisk micro SD.,5,Great product,1398038400,21-04-2014,231,0,0
A2KN55YK5O1HZO,C007WTAJTP,sadpony,"[0, 0]",I got this to add some room on my Samsung Galaxy S3. It works great. I do not have any complaints.,5,Works with Phone,1367193600,29-04-2013,588,0,0
A2CH2HX82W1KYM,C007WTAJTP,Safet Berisa,"[0, 0]",I use this card in my smartphone and it works great. It's fast and roomy (I got the 16GB version) enough to store all the music and video I need. It was immediately recognized by my Samsung smartphone when I put it in about 6 months ago and I've had no reason to take it out ever since.,5,Great memory card,1358467200,18-01-2013,689,0,0
A3DRTVU4CMKYAZ,C007WTAJTP,"Said Name ""Nope""","[0, 0]","The class is how fast the memory is read.  This is a fast card.  There are faster out there, but they are far more expensive, and not worth that expense, in my opinion.  Does everything perfectly and in a compact package.  SanDisk is a brand name, and trusted by me.  Worth the extra buck, since I've used SanDisk since they made 8MB CF cards&#8230;how far we have come&#8230;",5,"Love it, especially for the price",1387238400,17-12-2013,356,0,0
AQMVGSF0LQDHB,F007WTAJTQ,S. Albert,"[0, 0]",I wait for flash media sales to purchase SD card (various sizes).  I got the 64GB size for my GoPro 3+ and it works great.  I see no issues with the speed.  The price/GB was great on these.  Best of all this has been completely reliable for me.  No complaints whatsoever.,5,"Fast, Reliable, Decently Priced",1394755200,14-03-2014,269,0,0
A2K18NB5KZW7Y6,F007WTAJTQ,S. Alexander,"[0, 0]",This micro card has been seamless and simple to use.  The phone has not had any problems with this card.,5,32GB Card works well,1386201600,12-05-2013,575,0,0
A267IIIP8ODVIV,F007WTAJTQ,sal,"[0, 0]",this item came on time nice works well  they want 12 more words i just dont have then . .,5,good stuff,1353801600,25-11-2012,743,0,0
A2TYY8YPS1X128,F007WTAJTQ,Sal,"[0, 0]",Works on my Samsung Galaxy Note II. SanDisk is a product you can trust. Cheapest price I could find. Thanks!,5,MicroSD 64GB,1356652800,28-12-2012,710,0,0
A18MKVZDPEFYDB,F007WTAJTQ,Salim C. El-hayek,"[0, 0]",I love the card unfortunately my note 2 does not allow app install on the SD therefore i have not been able to fully test this card,5,microSD,1357171200,01-03-2013,647,0,0
AW6FSC7PQ91CS,B007WTAJTO,Salvador Laya Balbon,"[0, 0]",Already bought this one last may but you can't beat the new price. Original Sandisk products never failed me before. Just be careful where to buy.,5,should have gotten 2,1352937600,15-11-2012,753,0,0
A3SPRSLV03DT6Y,B007WTAJTO,t49y,"[0, 1]",The Size of a Finger Nail ! The little too easy to lose 64GB Card Plugged in so Easy ! So Quick ! In the Samsung Galaxy Note 10.1 ! With Out the Adapter ! Did it Help ? Still Too New at This ! Only Required 32GB ! Overkill ? Price too Close not to get IT ! Hope that it Helps ! Galaxy Note Phone is supposed to use IT ! Thanks Amazon ! Oh ! This is so Tiny ! Keep it in the Package ! Until You Need IT ! And Keep that Package some place where it can't be LOST ! IT is just Too Cute ! Thanks Again ! Cute ! Cute ! Cute !,5,Too Cute !,1355788800,18-12-2012,720,0,1
A3NGABXDIB0POU,F007WTAJTQ,Tactical Keychains,"[0, 0]",Works perfect in my Galaxy Tab 4,5,Tactical Keychains Approves!,1404604800,07-06-2014,184,0,0
A2RGWM5OACPAFT,F007WTAJTQ,Tad Cuper,"[0, 0]",This 64 gig unit lets me record hours of video in my GoPro Hero3. No need to carry extra memory cards with this unit for my website [...],5,Leaves plenty of recording room in my Hero3,1364428800,28-03-2013,620,0,0
A1DX95DF8G8BSU,F007WTAJTQ,Taher,"[0, 0]","No problem so far. Its fast and reliable. Working without glitch for 9 months. Uses 5gb out of 64 gb memory for internal use, so 59 gb is available. But thats good enough for heavy storage. Reasonably priced recommended for samsung galaxy s3.",5,Working Great for 9 months in S3,1362009600,28-02-2013,648,0,0
A3T5N2QVI8T92D,B007WTAJTO,tahoebigah,"[0, 0]",I bough this to replace an old 1gb card I had in my phone. I am using this in a Nokia Lumia 822 and it works perfectly.,5,Great product for a great price,1377993600,09-01-2013,698,0,0
A5RCLB4N34XCN,B007WTAJTO,Takah,"[0, 0]","its so much faster than normal sd's. I recommend this micro SD. it flies!the card reader was ok, tested it and worked but never really used it because its too big",5,fast&#34;,1355443200,14-12-2012,724,0,0
A13OV96DEUAR1F,B007WTAJTO,Talon8Ya,"[0, 0]",I've purchased 3 of the 32gb cards now. One each for my Galaxy S3 and my wife's. Also one for her Galaxy Tab 2 7.0.The cards are super fast and there have been no problems. The one in my S3 has been in it since they came out last year no issues at all.I purchased a 16gb for our Roku2.You can't beat the quality and price.,5,Excellent speed and quality.,1367020800,27-04-2013,590,0,0
AO68WBQPG1ZH9,F007WTAJTQ,tam60,"[0, 0]",Great price for a great product works great in my new Samsung Galaxy 4 why anyone [pays full price at the cell provider is beyond me! Keep up the good work Amazon love you guys!!,5,SanDisk 32 GB Memory Card,1374019200,17-07-2013,509,0,0
A3LT90XMQ0ZJM7,B007WTAJTO,Tamara Ching,"[0, 0]",great memory card.  i have trusted sandisk since it came out with memory products.  they work harder to keep innovating.,5,sandisk is the ultimate best,1375142400,30-07-2013,496,0,0
A3BGCHFP0ZSZJR,B007WTAJTO,tamathumper,"[0, 0]","It's a Micro SD card, it's 128 GB (which is amazing), and that's just about all I can say...  I do wish it was faster, because I've put 20-40GB virtual machine files on it and it took quite a while for them to copy.  I guess I'm used to SSD speeds.  But anyway, it adds a much-needed additional storage to my tablet.",5,What can I say?,1401926400,06-05-2014,216,0,0
A2WN0OAALLRM7A,B007WTAJTO,Tamaz,"[0, 0]","this is my 10th SDHC card.  I bought Sandisk only. good quality, good brand. recommend to friends. used in Galaxy Note 10.1",5,Sandisk is SANDISK always,1382918400,28-10-2013,406,0,0
A1TNJ5721Q0928,B007WTAJTO,U2,"[0, 0]",Yep. Works like it should.,5,Great,1404518400,07-05-2014,215,0,0
A3QV698W7K3DMX,B007WTAJTO,u e chapa,"[0, 0]","the micro card was a snap to insert into my tablet and now i have the extra storage should i ever need it.  i use sandisk cards on all my cameras also 'cause they're quality products, and i got this one for a great price too.",5,tiny but sweet!,1401580800,06-01-2014,336,0,0
ACDZ7TXNS156I,B007WTAJTO,ukswrath,"[0, 0]","Installed one of these in my Galaxy S4, nice addition. All my HD movies and audio files stream from this card, Perfect!",5,Fast & Reliable!,1372032000,24-06-2013,532,0,0
A10938QNO7IYIB,B007WTAJTO,"Ulises Bocchio ""Ulises Bocchio""","[0, 0]",Works great with my Samsung Galaxy Note 3. Now I have 96GB total memory! Awesome! The price was quite good too,5,Awesome!,1383609600,11-05-2013,576,0,0
