ReviewID,ProductID,reviewerName,helpful,ReviewText,Rating,summary,unixReviewTime,reviewTime,day_diff,helpful_yes,total_vote
A1KP58NXOH69XT,B007WTAJTO,Umang,"[0, 0]",Correctly priced. I bought it to use with my surface pro. Works great out of the box and transfer speeds are excellent.,5,Great!,1365465600,04-09-2013,460,0,0
A2QB5EM08KTI1G,B007WTAJTO,Umpire.20,"[0, 0]","I've used many SanDisk memory cards over the years.  This one ranks way up there just like all the others.  I am using it in a Samsung Tablet and it does all I want it to do.  I cannot comment on speed, since that isn't an issue to me.  For storage this is quite the gem.  And I bought it &#34;pretty cheap&#34;.",5,Another Quality Product from SanDisk,1391126400,31-01-2014,311,0,0
A2KVW8BZEQRI56,B007WTAJTO,Uncle Gary,"[0, 0]",I got this micro sd card strictly to hold music on my HTC One M8. I was able to fit approx 840 albums ripped at 192kbps vbr in AAC format using dBpoweramp. Couldn't ask for anything better. 5 stars.,5,Works great in my HTC One M8,1403308800,21-06-2014,170,0,0
A1NYUTV6F7O8V3,B007WTAJTO,"Underberg ""Underberg""","[0, 0]","It works just fine in my Galaxy 3s phone.  Now, I more room than I know what to do with.",5,Now I have lots of room.,1386374400,12-07-2013,514,0,0
A3K4F5DRZEXB5N,B007WTAJTO,unixman,"[0, 0]",Works fine in a Samsung Galaxy Note 2 - no need to format (although I did) - recognized as soon as it was popped in 59.47GB usable.Arrived really fast and nicely packaged.  I would order again.,5,Very Good,1356739200,29-12-2012,709,0,0
A2QHKAZAPFKHQ,B007WTAJTO,Unsatisfied,"[0, 0]",This is about the same as what you would pay at Costco but you don't have to pay the sales tax. Same card lower price. Nice.,5,Good card and good price,1390176000,20-01-2014,322,0,0
AQNR7IWYII4WW,B007WTAJTO,"USMC-Vet ""The Few The Proud""","[0, 0]","I really don't know that the complaints other posted were all about, but I have bought 3 of these sandisk micro sd card already.  for my phone, my wife and my daughter's phone. store lots of movies, pictures. videos....etc. all works just fine, no issues at all.",5,"What can you complain about??? it works; been using it for months now, no problem at all.",1379808000,22-09-2013,442,0,0
A2AC68C4B88P6U,B007WTAJTO,"V. Alapati ""venkata""","[0, 0]",my slr has sd cards that take time for the next click thought this would solve the problem as it says its faster and a way better product but i don't see that happening.,3,not something that i thought of.,1375660800,08-05-2013,579,0,0
A2BZKMVWBQ2VLE,B007WTAJTO,"Valentina ""DiveGirl55""","[0, 0]","SANDISK makes great products, I always try to buy their name. This is for the Sony digital recorder I also bought.",5,"SANDISK makes great products, I always try to buy their name",1399075200,05-03-2014,278,0,0
A324Q16NTIRFR9,B007WTAJTO,"Vanessa Roberts ""Book Lover""","[0, 0]","I got the &#34;Ultra&#34; becuase it said it lets your camera phone save pictures faster, it seems to do that. Also, it was a great price.",5,It seems faster,1364947200,04-03-2013,644,0,0
AWWW84R8Q4JG9,C007WTAJTP,varma1986,"[1, 1]","I purchased this Micro SD card with adapter to supplement my UltraBook which came with a MSata storage of only 128Gb.The 64 GB SD Card is a whole lot of storage and the prices of these have fallen to low in recent times and believe will fall further as newer technologies will come.I would recommend this 64GB original SanDisk Micro SD card for anyone who needs large storage space at good prices, especially for the Samsung Galaxy S2 & S3 or the UltraBooks.",5,Good Price Large Storage,1349481600,10-06-2012,911,1,1
A72K096ZOUAJL,B007WTAJTO,Varune,"[0, 0]",not much to be said about this. sandisk makes some of the best SD cards..i have even washed mine in the washing machine by mistake and it still works,5,you can never go wrong with sandisk,1389830400,16-01-2014,326,0,0
A2L8FUCG0CYD4H,B007WTAJTO,vato,"[0, 0]","this item works great but maybe a better price would be better, I use it on my phones works great",4,good deal,1374364800,21-07-2013,505,0,0
A1IIFU05LM2VK8,D007WTAJTR,Vatsal Agarwal,"[0, 0]",Been using this card in my Nokia Lumia 820 for over a year now. It gives decent speed and works good. No issues at all.,5,Good product,1395705600,25-03-2014,258,0,0
A280KHZO2L7GKA,D007WTAJTR,V. Aub,"[0, 0]","I use this in my Galaxy S3 so that I can carry all my MP3s that are on my iPOD classic (45GB).The only complaint I have is not with this unit, but with smartphones in general.  They are still to sensitive to be used as a true mp3 player replacement.  If you are not too careful, you may crack the screen on your phone if you try to use it as an all-purpose media player.My ipod classic is five years old and it has yet to have its screen crack on me.  It definitely hold up better at the gym than my phone.  Anyway, this SDXC card is great.",5,Great Mass storage device for your smartphone,1355702400,17-12-2012,721,0,0
AIVU1J51MJ9O2,D007WTAJTR,"Vaughn ""The answer man!""","[0, 0]","It amazing how much data they can fit on these tiny cards these days.  When I saw this 32gb class 10 card for $20, I snatched it up for my 10&#34; Android tablet to hold my library of kids DVD movies I converted to tablet video for my kids to watch while on the road.  It works great and the kids love it.",5,Works great!,1381968000,17-10-2013,417,0,0
A2COG0JN3ACP8,D007WTAJTR,V. Cortes,"[0, 0]",Overall great price per gigs  real money saver . Expands my tablets memory 10 fold as well as keeping it from crashing,5,Great product good price,1390953600,29-01-2014,313,0,0
A1FQFDCXTGY1PU,D007WTAJTR,VuKu the GreaT,"[0, 0]",This is the reason why I love non-apple products. You can increase memory with microsd's and its so much cheaper. These class 10 Sandisks' are amazing. I've bought several from 64gb to 16gb and every single one has lasted. I've had the 64gb for months now and I have no issues. The 16gb I've had for a year and its great. I would highly recommend this product.,5,Great price to increase your memory 10fold.,1362268800,03-03-2013,645,0,0
A2N9ADDVQCMS42,C007WTAJTP,"Wade ""Wade""","[0, 0]","PROsIt copies large files to the card at ~10-12 MB/s and it doesn't choke when slammed with a few hundred little files like pictures and mp3s. It writes 8mp images with a quickness and 1080p 20mbit recording is smooth in my LG Optimus G E970. I waited for these to get to ~this price before ordering, and as usual Amazon Prime is awesome.CONsNot as fast as the gold 16GB SanDisk microSD cards but for 64GB in this form factor, it's faster than I was anticipating.",5,"Slightly over advertised speed in exFAT, barely rated speed in FAT32 :-)",1356134400,22-12-2012,716,0,0
A2EG3ZPSDXOBLU,C007WTAJTP,Wael,"[1, 1]","see,,, I own an HTC HD2 with cyanogen Android Rom on it,, I wanted maximum memory capacity for various storage needs including shooting HQ videos ,,, I used to have a patriot 32GB Class 10 on it but the performance wasn't up to my expectations ,,,this badboy right here peroformed like a champ on my smartphone ,,, Alert : ""IT WORKS ON HTC HD2"" ,,,,once I popped this card on my laptop to transfer my data on it,,, I got no less than 14MB\S write speed which is above the specs of the this card,,,Apps access in FAAAST ,,, so far I'm pleased with it ,,, I'll update this after a While when I use it intensively ,,,well done SanDisk ,,,",5,"Well Done Product ,,,,",1343088000,24-07-2012,867,1,1
A28621TSIR5EOG,D007WTAJTR,"Walk Around ""Osprey""","[0, 0]","Have more than one of these MicroSDHC disks and they hold up in my MP3 players, phone, recorder camera etc.",5,SanDisk Ultra 32 GB MicroSDHC C10/UHS1 Memory Card,1387238400,17-12-2013,356,0,0
A10B2J2IRQXBWA,D007WTAJTR,walter goodwyn,"[0, 0]","super addition to my tablet,it gives me the space need for my music. I am very satisfied with quality as well as price.",5,my music saver,1384214400,11-12-2013,362,0,0
A16MAT54GTKJYS,D007WTAJTR,Walter Satterthwait,"[0, 0]","A fine product.  I've been using mine for over a year now, and it's never punked out on me.  I just bought another one, to use as a spare.  Delivered on time, reliable, priced fairly.",4,SanDisk Ultra 32 GB MicroSDHC C10/UHS1 Memory Card with Adapter...,1394150400,03-07-2014,158,0,0
A1GUPXR3NSTT9Q,D007WTAJTR,Walt,"[1, 3]","I own the Samsung Galaxy Tab 2 10.1I bought the 64g microSD card..(please keep in mind I know NOTHING about computers and I was able to do this.)I put it in the device to format...the tablet couldn't read it.  Would never mount.  Tried to format it with my computer....and still just wouldnt work..although it would be formatted.  Remember, I was using all defaults.Sent it back, Amazon sent me another one. (Amazingly fast service)...same thing.I called Amazon...they knew of no issue why my tablet wouldn't accept the card. (I would think that their customer service dept. would stay on top of these posts because I found that this was a HUGE issue)On my THIRD card I did some research.  For whatever reason for this SD card to work it must be formatted as a FAT 32 NOT an exFAT.  BUT...(this is the rub)...windows only allows for formatting either to exFAT or NTSF...(at first, I thought it was an adult swim reference).....so....that sucks....this means that I can't use this card because I can't format it properly.  But wait..there's more....there is a super easy fix....any idiot can do it.....from start to finish took me all of 45 seconds (after reading instructions)...and ta-duh.....now the micro SD card works fine. Thank-you Amazon for your excellent return policy..(super fast, super easy, super friendly)...BUT your live customer service should know about this.  I can't fault the operator...she was nice..seemed genuinely concerned and tried to make it right)...ok.. no more stalling..here is the address of the youtube video.  link to website is in the description.[...] ...link to website in description.  I used all defaults and worked perfect.  or search youtube - convert fat32",5,Samsung Galaxy Tab 2 - 10.1  - Did not work..had to convert from exFAT to FAT32 guide for idiots,1358208000,15-01-2013,692,1,3
A3PEJQ737X837L,D007WTAJTR,Washington,"[0, 0]","PERFECT,NO COMPLAINTS,USED AS A VIDEO CARD,ALMOST 5 HOURS OF VIDEO ON THIS LITTLE PIECE OF S,,,,,,,, HA I REMEMBER THE VHS TAPE,ARE WE GETTING CRAZY?",5,WORKS GREAT,1386547200,12-09-2013,452,0,0
A1F96SBHYYZ11U,D007WTAJTR,"watches ""enthusiast""","[0, 0]","never had a problem with it,it does exactly what it is made to do,love Sandisk product,smooth operation,high price but worth it.get it if you like to save,by waiting a day or two.enjoy",5,sandisk ultra 32 gb micro sdhc c 10/uhs1 memory card with adapter,1382227200,20-10-2013,414,0,0
A1QQA7Y92L4F9R,D007WTAJTR,Wavey Davey,"[0, 0]","People often ask me about bargain-basement pricing on no-name brands of media, and you know I just have to cite my own experiences with cheap media, and it's just that, cheap media, prone to failure or worse if it's a complex format as this one is, the SDXC format. They have crammed a TON of memory modules in that little bujgger, you know? I say go with experience, go with a leader in the field, so there's pretty much SanDisk at the top of the heap, and the rest trail far, far behind in volume and precision assembly techniques...so I vote for SanDisk every time, and unless my experience is changed  by some anomaly I'll keep on recommending SanDisk above all others.It's rated at 40MB/sec write speed, which is enough to keep up with even the fastest real camera or phone camera out there in the wild, and it certainly keeps up with my Samsung Note 3's 13-mega-pixel rocket camera, one that shoots up to 8fps in burst mode taking certain shots, so if it works for that camera perfect, chances are it will work for your setup great also!Buying the SanDisk memory module costs what, $5-$7 more than the others max, right? I say buy this one here, it's a winner in all respects.Wavey Davey 1-12-2014",5,SanDisk makes a MEAN SDXC-series of Micro-USB chips!,1389484800,01-12-2014,7,0,0
ARYHQ16DV5B9Q,D007WTAJTR,"Wayne B. Hodges ""WBH""","[0, 0]",I am familiar with Sandisk and the quality of product is obvious to me because it installed in my Lumia 820 and it works great.,5,MicroSD right,1366156800,17-04-2013,600,0,0
A3C9SYXO9UQ9VI,D007WTAJTR,wayne,"[0, 0]",bought for garmin gps. works very well. also has adapter for sdhc size memory card to plug into reader if you don't have a micro card reader,5,SanDisk Ultra 16 GB MicroSDHC Class 10 UHS-1 Memory Card,1391904000,02-09-2014,97,0,0
AWNYBOENG7FJA,D007WTAJTR,wayne,"[0, 0]","I bought two as a back up for my Gopro Hero 3.One from Amazon the other was a gift from BB.Both did not work in my cameras, thinking it was Gopro's new update.Kept getting a SDERRI returned other and it worked with no problem.NOTE to all, there are boot-legged products out there It is hard todetect. But of all the Items I've received from Amazon/Prime and beyondHave been great. I just got stuck with a bad batch.GoPro recommends HX,HC,XC and extreme micro cards.",2,Was it me or my camera,1389830400,16-01-2014,326,0,0
A1T0VXIRCZVXKZ,D007WTAJTR,W. B. Kristiansen,"[0, 0]",Great buy for this SanDisk 16 GB memory. Worked well in my Samsung S4 smartphone. I mainly use the extra memory to save photos and music. Like the adapter that I use frequently to copies files to my desk top pc.,5,I saved money buying this SanDisk from Amazon that sold for double the price at Staples and Best Buys.,1396310400,04-01-2014,338,0,0
A2CBOTHF2PZW9M,D007WTAJTR,Xavier H.,"[0, 0]","I bought it for just 23 USD, it is very fast and reliable, simply the best option for a 10 class micro SD of 32GB.UPDATE:11-08-2013Don't buy it for using it on a Samsung Galaxy S3, there's seem to be an issue between the phone an this particular reference that makes that after a while the MicroSD card lost its data and get nonfunctional. I can't be repair after that, so it gets totally useless. You can tell the card is going to fail before it's too late because constantly the phone shows a notification indicating that the card was ejected and it needs to be mounted again. When this happens I strongly recommend you to backup your data and change the MicroSD card of your phone and use it in other device before it gets corrupted.",5,"Ultra fast, reliable and cheap 5/5",1355529600,15-12-2012,723,0,0
A2JFRH4RUR7ZB9,D007WTAJTR,xcgfatboy,"[0, 0]","I got this for my new Microsoft Surface Pro, just in case I needed more room. It comes with a adapter if needed and works great for more storage room.",5,Small but BIG,1364601600,30-03-2013,618,0,0
A3UR2N0ATGBCU8,F007WTAJTQ,X. Chen,"[0, 0]","plug in to the phone shows up sd card, but didn't give me the option to format, plug in to the laptop, same thing. Thought it was DOA. But later realized that I had to format the card from the flip down menu. Now it works Perfect. Was going to look for a Gen4 64gb ipod touch, $350 vs $55 makes no sense. Plus The Galaxy S2 T727 works just fine as a media player.",5,Works Great on my Galaxy S2 T727,1349308800,10-04-2012,972,0,0
A3K8V7WFKJBQWG,D007WTAJTR,"xendula ""avid e-Book reader""","[0, 0]",In constant use on my Samsung Ativ 700t since January with narry a problem. I just bought my third one :),5,Constant use since January '13 - going strong,1385337600,25-11-2013,378,0,0
A2P1GTW1PO6X0V,D007WTAJTR,XIANER,"[0, 0]","I can use it to store my data~ It is good for my computer~Also , it is fast~It is a great way to store data~never lost~",5,It is a good micro SD card~,1357603200,01-08-2013,494,0,0
A1749QO20EC9IZ,D007WTAJTR,Xiaolong Zhang,"[0, 0]",Good price. Fast and useful to expand more storage for the newly bought Asus tablet. Build quality looks great. It conveniently came with two adaptors so it can be fit to other computers when copying files.,5,A very nice card to be used with tablet,1373500800,07-11-2013,396,0,0
A12P4PSWWXUYA0,D007WTAJTR,xplics,"[3, 5]",Buyer beware card unreadable from the get go. Luck for me amazon helped me out. There are many others on here that know how to format to Fat32 threw Window 7 and have had same issues.,1,Like others reviewed not that great of a card.,1348012800,19-09-2012,810,3,5
A1OTC0E0KG0TYH,D007WTAJTR,Xpolicy,"[0, 0]",No problem here. I use it in my Samsung Note 10.1. It is a little slow writing to it but such are micro SD cards.,4,No Problem,1396310400,04-01-2014,338,0,0
AP7ELOKYSDI7B,D007WTAJTR,Yachtwork,"[0, 0]",It worked for a GoPro so what more to say except I wonder how they can fit 64 gigs on such a small chip. Amazing.,4,It worked,1382227200,20-10-2013,414,0,0
A29VPWQZC2A62R,D007WTAJTR,"Yafis Rai ""Blaster""","[0, 0]","Got a really good deal on this humongous capacity card on Black Friday, Thanks Amazon, been waiting for the price to go down.Using this on a Galaxy S3 as FAT 32. I was unable to get this recognized in the phone as an ExFat. Anyone having problems with this in the Galaxy Lineup of phones might want to try the FAT 32 formatting.",5,Black Friday Special Buy,1354492800,12-03-2012,1001,0,0
A3TGY6ZWPMOPHE,D007WTAJTR,yali g,"[0, 0]",So far i haven't had any issues. It's working and is compatible with my phone. Quick shipping. Im satisfied with my purchase,5,16gb micro,1379289600,16-09-2013,448,0,0
ANIETNRXG4B27,D007WTAJTR,"Yancy Smith ""-Yancy-""","[0, 0]","I ordered this card for my Samsung Note 3.  I had to properly format it for my phone which was easy.  I transferred all of my pictures and music from my old card and it works like a charm.  I picked this card as it is the max the phone allows.  This card was a very good price and I got it next day during the Christmas rush even though I used my free 2 days shipping.I would buy another if I had another device to use it in.I would buy again!As usual, SanDisk is affordable and works well!",5,Great Memory Card,1392940800,21-02-2014,290,0,0
A1GRKJ0VT3HUNB,D007WTAJTR,Yankeefan,"[0, 0]",This sd card is perfect for my phone. It is the right size and especially the right price. After looking all over Amazon price for this card was almost $10 lower than everyone else's.,5,Love It,1397606400,16-04-2014,236,0,0
AURSNOUY8QG32,D007WTAJTR,Yevgeniy P.,"[1, 1]",So I got this during the amazon litening deal during black friday for 17$! It is the best and fastest card money can buy. It came in very easy to open packaging. I put it into my Galaxy S3 and was good to go. Highly recommend.,5,Best Micro SD,1355443200,14-12-2012,724,1,1
A85ZIIDB427XP,D007WTAJTR,"Y-Not ""John""","[0, 0]",Not much else to say - an SD card is an SD card - performance met expectations - have had good luck with Sandisk,5,Good Price,1394236800,03-08-2014,127,0,0
A2XZM6IEU8R4UH,C007WTAJTP,yo,"[0, 0]","Easy installation, immediate functionality, great way to expand my phone's photo storage capacity. I am very pleased with this purchase,",5,Great addition to my Samsung Note II phone,1396828800,04-07-2014,157,0,0
A1NHVIBDBI15V1,C007WTAJTP,Yonghing Fung,"[0, 0]",its ffast light weight.. great price nothing to say here.. just a memory carduse it for my gopro hero 3 black,5,got this for my gopro hero 3 black,1393459200,27-02-2014,284,0,0
A3S81Y50UL7UZV,C007WTAJTP,yon may,"[0, 0]","Transfer speeds are consistent with advertising. The card works, and has worked for months now. Great product. Now I need a 64gb..... At least I know which company to go with, SanDisk.",5,"good memory card, good price.",1355270400,12-12-2012,726,0,0
A2BOSVUG4SLYHS,C007WTAJTP,Yoon S. Choe,"[0, 0]","it just works great as it supposed to be, i would buy one more for my wife gallaxy S4, thanks!",5,good product!,1401321600,29-05-2014,193,0,0
A1RMOES5FGRF00,C007WTAJTP,"Zabeatta ""Zabeatta""","[0, 0]",I got this for my Samsung Galaxy S5 and could not be happier. It's fast enough with the still and video camera on the phone.I have had no problems transferring files of all types from my pc or tablets. At this price it is a great buy.,5,Great for the Galaxy S5,1399075200,05-03-2014,278,0,0
A2N07667BLEYCG,C007WTAJTP,Zachary A. Hart,"[0, 2]",Works great as advertised.  No problem with formatting or anything.  Appears to be class 10 as advertised.  Thanks a bunch!,5,Works as advertised,1395964800,28-03-2014,255,0,2
AP8TRLDSLWVUT,D007WTAJTR,"Zachary Burns ""Computer Guru""","[0, 0]",Works just fine in my video camera in the car.  And I saved over 15 bucks over Best Buy (which always tries to rip you off).,5,Works Great,1390435200,23-01-2014,319,0,0
A2FRK17ETLK7UY,C007WTAJTP,Zachary Flategraff,"[0, 0]","Super fast access to my Samsung Galaxy Note II. SanDisk Ultra Micro HC is blazing fast compared to the other microSD cards I have bought including PNY, Sony and more!",5,Awesome for Price and Very fast data accessibility!,1385164800,23-11-2013,380,0,0
A3DJS9HZ1FPANU,D007WTAJTR,Zach S.,"[1, 1]","This was the fastest microSD card I have tested, unfortunately it died after about four months of use in my Android phone. At first my phone would randomly say the card had been removed, then eventually neither the phone nor any reader I had could access it.The test results from my older but still functional 32gb class 4 sandisk:Sequential Read :  23.022 MB/sSequential Write :  4.460 MB/sRandom Read 512KB :  22.387 MB/sRandom Write 512KB :  3.144 MB/sRandom Read 4KB (QD=1) :  3.414 MB/s [  833.5 IOPS]Random Write 4KB (QD=1) :  1.231 MB/s [  300.5 IOPS]Random Read 4KB (QD=32) :  3.309 MB/s [  807.8 IOPS]Random Write 4KB (QD=32) :  0.993 MB/s [  242.4 IOPS]Compared to this product, 32gb class 10 sandisk:Sequential Read :  41.492 MB/sSequential Write :  15.653 MB/sRandom Read 512KB :  43.380 MB/sRandom Write 512KB :  17.685 MB/sRandom Read 4KB (QD=1) :  4.696 MB/s [  1146.5 IOPS]Random Write 4KB (QD=1) :  1.595 MB/s [  389.4 IOPS]Random Read 4KB (QD=32) :  4.859 MB/s [  1186.2 IOPS]Random Write 4KB (QD=32) :  1.334 MB/s [  325.6 IOPS]",1,Fast but short-lived,1363910400,22-03-2013,626,1,1
A2SVI2JSSMA3PS,C007WTAJTP,Zackariah Zielieke,"[0, 1]","Hello,Great card, great price. Plenty of speed and worked for...about a year. In fact, I wish it had stopped working a month earlier.It looks like Sandisk is out to make sure their cards stop working perfectly after the return window is up or something, because now on the end of December (Return window expired about 20 days ago) this thing only intermittently is recognized. It unmounts all the time in my phone and then gets remounted, and usually it doesn't even remount.While it was a good price, it was a good price for a name brand card that would have lasted longer than a year instead of Sandisk going &#34;ahaha got you good, now you have to buy another expensive name-brand card!&#34;Nope, I'll buy a cheaper alternative and it'll probably last longer. I still have some Kingston's going strong.",1,It worked good until return policy was out,1388016000,26-12-2013,347,0,1
A8FI3MT1LNQS,C007WTAJTP,Zafer Aktan,"[1, 1]","I have purchased this SD card to have extra storage area for my Galaxy Note 2.  As you might already know, Galaxy Note 2 does not allow applications to run from external cards, but it allows storing media, documents, etc to the external card.  It also comes with a full size SD card conversion piece (just insert the micro sd card into the full size SD card piece and voila) - with it's current pricing on Amazon.com, this card is highly recommended.  Hope this review proves to be useful.Cheers",5,works fine on Galaxy Note 2,1362700800,03-08-2013,492,1,1
A10WTI6XS1CX37,C007WTAJTP,Zahid,"[0, 0]",Really helpful I needed to backup some photos and there was plenty of space left,5,32G,1405036800,07-11-2014,31,0,0
A2NZ4SKQ501HBS,C007WTAJTP,"Zain Naboulsi Jr. ""zainnab""","[0, 0]",No issues it works great in my device. I don't think it would require more words but I'll type them since it's required.,5,Works great!,1371513600,18-06-2013,538,0,0
A301Z8IOK3T238,C007WTAJTP,"Zak ""Diva""","[0, 0]",I use it to hold files from my computer and transfer files from other computers it works good for this task and is quick. I would recommend this plus the price isn't bad.,5,Good SD Card,1374278400,20-07-2013,506,0,0
